{
  "schemaVersion": "2.0",
  "registryVersion": "3.0.0",
  "activeKeys": [
    "BUILD_TARGET",
    "KAZEN_TARGET",
    "KAZEN_LOCATION",
    "KAZEN_BETTER",
    "KAZEN_SCOPE",
    "KAZEN_PERMISSION",
    "KAZEN_PROOF",
    "KAZEN_INTERVAL",
    "KAZEN_CONTRACT_APPROVAL",
    "ENTRY_MODE",
    "INTERVIEW_MODE",
    "JOB_ARCHETYPE",
    "STEP1D_APP_CONFIRM",
    "STEP1D_DESKTOP_SHAPE",
    "STEP1D_DB",
    "STEP1D_ACCOUNTS",
    "STEP1D_MOBILE_STORE",
    "STEP1D_MOBILEWEB_SHAPE",
    "STEP1D_WEB_PAGES",
    "STEP1D_WEB_COMPLEXITY",
    "STEP1D_WEB_HOSTING",
    "STEP1D_FUNNEL_GOAL",
    "STEP1D_FUNNEL_OFFER",
    "STEP1D_FUNNEL_PIECES",
    "STEP1D_FUNNEL_SHAPE",
    "MEDIA_CREATE_OR_SUPPLY",
    "MEDIA_PROVIDER_CHOICE",
    "MEDIA_MODEL_PICK",
    "MEDIA_KEY_NEEDED",
    "CAPACITY_HARNESS_CONFIRM",
    "CAPACITY_PLAN_DEEPSEEK",
    "CAPACITY_PLAN_OLLAMA",
    "CAPACITY_PLAN_AGNES",
    "CAPACITY_PLAN_RECALL",
    "CAPACITY_OPENROUTER_KEY",
    "CAPACITY_EFFORT_SETTING",
    "CAPACITY_AGENT_COUNT",
    "CAPACITY_THREE_SEAT",
    "CAPACITY_PROVIDER_PATH",
    "REPO_AMBIGUITY",
    "REPO_NEVER_PUSH",
    "LOOP_FOLDER",
    "LOOP_DONE_CONDITION",
    "GAUNTLET_EXAMPLE",
    "GAUNTLET_WINNING_BAR",
    "GAUNTLET_DOWNLOAD_CONSENT",
    "GAUNTLET_AVOID",
    "COLLAPSE_CONFIRM_B",
    "COLLAPSE_CONFIRM_C",
    "AGENT_TEAM_CONSENT",
    "STEP17_REPO_ASK"
  ],
  "retiredKeys": [
    {
      "key": "B3",
      "skill": "spec-protocol",
      "meaning": "Historical repository question; retired by current operator ruling.",
      "retiredIn": "2.0.0",
      "replacement": null
    },
    {
      "key": "C7",
      "skill": "spec-protocol",
      "meaning": "Never a valid independent question; C6 clauses remain fields of C6.",
      "retiredIn": "2.0.0",
      "replacement": "C6"
    },
    {
      "key": "C8",
      "skill": "spec-protocol",
      "meaning": "Never a valid independent question; C6 clauses remain fields of C6.",
      "retiredIn": "2.0.0",
      "replacement": "C6"
    },
    {
      "key": "A4_DEFAULT_FORM",
      "skill": "spec-protocol",
      "meaning": "R2 deleted in default mode; the run takes the measured maximum and says so.",
      "retiredIn": "3.0.0",
      "replacement": "CAPACITY_AGENT_COUNT"
    },
    {
      "key": "A6_USAGE_WINDOW",
      "skill": "spec-protocol",
      "meaning": "R2 deleted; windows are knowable and measured.",
      "retiredIn": "3.0.0",
      "replacement": null
    },
    {
      "key": "A7_SHARE_FREE",
      "skill": "spec-protocol",
      "meaning": "R2 deleted; standing default applied and recorded.",
      "retiredIn": "3.0.0",
      "replacement": null
    },
    {
      "key": "A8_BACKUPS",
      "skill": "spec-protocol",
      "meaning": "R2 deleted; read the wiring, report FINDINGS.",
      "retiredIn": "3.0.0",
      "replacement": null
    },
    {
      "key": "A2_PROVIDER_PATH",
      "skill": "spec-protocol",
      "meaning": "R2 deleted half; a RULE, reported never asked.",
      "retiredIn": "3.0.0",
      "replacement": "CAPACITY_PROVIDER_PATH"
    },
    {
      "key": "B1_REPO_COUNT",
      "skill": "spec-protocol",
      "meaning": "R2 deleted for new projects; folded into REPO_AMBIGUITY.",
      "retiredIn": "3.0.0",
      "replacement": "REPO_AMBIGUITY"
    },
    {
      "key": "B2_BRANCH_PUSHER",
      "skill": "spec-protocol",
      "meaning": "R2 deleted for new projects; folded into REPO_AMBIGUITY.",
      "retiredIn": "3.0.0",
      "replacement": "REPO_AMBIGUITY"
    },
    {
      "key": "C0_WATCHED_OR_NOT",
      "skill": "spec-protocol",
      "meaning": "R2 deleted; standing answer recorded, never asked.",
      "retiredIn": "3.0.0",
      "replacement": null
    },
    {
      "key": "C1_STATE_FILE",
      "skill": "spec-protocol",
      "meaning": "R2 deleted; the skill creates the ledger.",
      "retiredIn": "3.0.0",
      "replacement": null
    },
    {
      "key": "C2_APPROVE_MERGES",
      "skill": "spec-protocol",
      "meaning": "R2 deleted; auto-merge always.",
      "retiredIn": "3.0.0",
      "replacement": null
    },
    {
      "key": "C3_DURATION",
      "skill": "spec-protocol",
      "meaning": "R2 deleted; recorded standing answer.",
      "retiredIn": "3.0.0",
      "replacement": null
    },
    {
      "key": "C6_BUSY_SIGNAL",
      "skill": "spec-protocol",
      "meaning": "R2 deleted as question, wired as backoff ladder.",
      "retiredIn": "3.0.0",
      "replacement": null
    }
  ],
  "keys": [
    {
      "key": "BUILD_TARGET",
      "skill": "spec-protocol",
      "meaning": "Product idea and audience in the user's own words.",
      "source": {
        "path": ".claude/skills/spec-protocol/SKILL.md",
        "anchor": "THE BUILD TARGET QUESTION",
        "digest": "1a603237408f5befe6df82b47754455fe44945a693a5caf6998902d2e50e838d"
      },
      "display": "First question, and it is an easy one, because you already know the answer — it is your idea. Tell me about it in your own words: what is it, and who is it for? A sentence or two is plenty, and describing it the way you would describe it to a friend is exactly right. There are no special words to know. I will tell you what I heard, and you tell me if I got it right.",
      "spoken": "First question, and it is an easy one, because you already know the answer — it is your idea. Tell me about it in your own words: what is it, and who is it for? A sentence or two is plenty, and describing it the way you would describe it to a friend is exactly right. There are no special words to know. I will tell you what I heard, and you tell me if I got it right.",
      "answerKind": "free_text",
      "allowedInputModes": [
        "voice",
        "typed",
        "terminal"
      ],
      "options": null,
      "validation": null,
      "privacy": {
        "sensitivity": "normal",
        "readAloud": true,
        "caption": "show",
        "log": "redact",
        "personalOptIn": false
      },
      "count": {
        "counted": false,
        "classification": "STATIC",
        "progressRule": "none"
      },
      "conditions": {
        "op": "true"
      },
      "retry": {
        "maxRetries": 1,
        "dontKnow": "accepted",
        "default": "none"
      },
      "resume": {
        "pendingRecovery": "same-key-once",
        "answeredKey": "never-reask"
      },
      "helpText": "A sentence or two is plenty.",
      "canGoBack": true
    },
    {
      "key": "KAZEN_TARGET",
      "skill": "kaizen",
      "order": 1,
      "meaning": "Kaizen Recipe target, purpose, and audience.",
      "source": {
        "path": ".claude/skills/kaizen/references/onboarding.md",
        "anchor": "1. Target",
        "digest": "2383a7fdb7ae0c1db3d231db9db442609251bebc20f8887870a7db183f8a4274"
      },
      "display": "What are we trying to make better? It can be an app, website, funnel, process, document, automation, or something else.",
      "spoken": "What are we trying to make better? It can be an app, website, funnel, process, document, automation, or something else.",
      "answerKind": "free_text",
      "allowedInputModes": [
        "voice",
        "typed",
        "terminal"
      ],
      "options": null,
      "validation": null,
      "privacy": {
        "sensitivity": "normal",
        "readAloud": true,
        "caption": "show",
        "log": "redact",
        "personalOptIn": false
      },
      "count": {
        "counted": false,
        "classification": "STATIC",
        "progressRule": "none"
      },
      "conditions": {
        "op": "true"
      },
      "retry": {
        "maxRetries": 1,
        "dontKnow": "accepted",
        "default": "none"
      },
      "resume": {
        "pendingRecovery": "same-key-once",
        "answeredKey": "never-reask"
      },
      "helpText": "A sentence or two is plenty. If you do not know the technical category, I will infer it and confirm.",
      "canGoBack": false
    },
    {
      "key": "KAZEN_LOCATION",
      "skill": "kaizen",
      "order": 2,
      "meaning": "Kaizen Recipe location and available access.",
      "source": {
        "path": ".claude/skills/kaizen/references/onboarding.md",
        "anchor": "2. Location",
        "digest": "2383a7fdb7ae0c1db3d231db9db442609251bebc20f8887870a7db183f8a4274"
      },
      "display": "Where can I find it so I know where to work?",
      "spoken": "Where can I find it so I know where to work?",
      "answerKind": "free_text",
      "allowedInputModes": [
        "voice",
        "typed",
        "terminal"
      ],
      "options": null,
      "validation": null,
      "privacy": {
        "sensitivity": "normal",
        "readAloud": true,
        "caption": "show",
        "log": "redact",
        "personalOptIn": false
      },
      "count": {
        "counted": false,
        "classification": "STATIC",
        "progressRule": "none"
      },
      "conditions": {
        "op": "true"
      },
      "retry": {
        "maxRetries": 1,
        "dontKnow": "accepted",
        "default": "none"
      },
      "resume": {
        "pendingRecovery": "same-key-once",
        "answeredKey": "never-reask"
      },
      "helpText": "Current folder, GitHub repo, a URL, a hosted platform, or a local document. \"I do not know\" is fine — I can look at the current folder and tell you what I find.",
      "canGoBack": false
    },
    {
      "key": "KAZEN_BETTER",
      "skill": "kaizen",
      "order": 3,
      "meaning": "Kaizen Recipe improvement direction.",
      "source": {
        "path": ".claude/skills/kaizen/references/onboarding.md",
        "anchor": "3. Better",
        "digest": "2383a7fdb7ae0c1db3d231db9db442609251bebc20f8887870a7db183f8a4274"
      },
      "display": "What would you especially like me to make better? This helps me aim, but it does not limit what I can notice.",
      "spoken": "What would you especially like me to make better? This helps me aim, but it does not limit what I can notice.",